{
  "protocol_version": "0.1.0",
  "run_id": "run_complete-fixture",
  "run_outcome": "completed",
  "evidence_status": "complete",
  "finalized_at": "2026-01-01T00:00:03Z",
  "chunks": [
    {
      "protocol_version": "0.1.0",
      "run_id": "run_complete-fixture",
      "ordinal": 0,
      "sequence_range": {
        "first": 0,
        "last": 1
      },
      "event_count": 2,
      "digest": "sha256:332064fd205710ab62a46bda52d55fea73ee78c5615c1b23f9ce2b2c9c34ebe4"
    },
    {
      "protocol_version": "0.1.0",
      "run_id": "run_complete-fixture",
      "ordinal": 1,
      "sequence_range": {
        "first": 2,
        "last": 3
      },
      "event_count": 2,
      "digest": "sha256:c433d097da83dbf8702d9f263eb904f9909abf2d3a494d72a613c8c66a6cdda5"
    }
  ],
  "artifacts": [
    {
      "artifact_id": "artifact_model-output",
      "digest": "sha256:dbb56ddca2b4b9d42e0905ebe489c134eabb4dbd0d52352179849f330b921bdd"
    },
    {
      "artifact_id": "artifact_projection",
      "digest": "sha256:11c11db30f4b3f6c758722ba3e27eea08145b7d212f6a157451e364b48475280"
    }
  ],
  "objective_result": {
    "artifact_id": "artifact_objective-result",
    "digest": "sha256:87f955f589fc5a82ddad818c1087948db3f11013e1806e073584c1e3e3666e3b"
  }
}
